page,key,translation_notes,en,fr,de,ar,bg,zh-CN,zh-TW,hr,fi,tl,el,hi,hu,id,it,ja,ko,ms,pt,pl,ro,ru,es,sw,sv,th,tr,uk,vi
2PP vs 3PP,pref_2PP_3PP,,"You are either Person A or Person B, but you do not know which one. <br> Would you prefer that <b>{person1} can remove points</b> (left) <u>or</u> <b>{person2} can remove points</b> (right) in Stage 2?","Vous êtes soit la Personne A, soit la Personne B, mais vous ne savez pas laquelle. <br> Préféreriez-vous que <b>{person1} puisse supprimer des points</b> (à gauche) <u>ou</u> <b>{person2} puisse supprimer des points</b> (à droite) à l'étape 2 ?","Sie sind entweder Person A oder Person B, wissen aber nicht, welche von beiden. <br> Möchten Sie, dass in Phase 2 <b>{person1} Punkte abziehen kann</b> (links) <u>oder</u> <b>{person2} Punkte abziehen kann</b> (rechts)?",أنت إما الشخص أ أو الشخص ب، ولكنك لا تعرف أيهما. <br>هل تفضل أن يتمكن <b>{person1} من إزالة النقاط</b> (يسار) <u>أو</u> يتمكن <b>{person2} من إزالة النقاط</b> (يمين) في المرحلة 2؟,"Вие сте или Лице А, или Лице Б, но не знаете кое. <br> Бихте ли предпочели <b>{person1} да може да премахва точки</b> (вляво) <u>или</u> <b>{person2} да може да премахва точки</b> (вдясно) в Етап 2?",你要么是人 A，要么是人 B，但你不知道自己是哪一个。<br>在第 2 阶段，你希望<b>{person1} 可以删除分数</b>（左）<u>还是</u> <b>{person2} 可以删除分数</b>（右）？,,"Ili ste osoba A ili osoba B, ali ne znate koja. <br> Želite li da <b>{person1} može uklanjati bodove</b> (lijevo) <u>ili</u> <b>{person2} može uklanjati bodove</b> (desno) u Fazi 2?","Olet joko henkilö A tai henkilö B, mutta et tiedä kumpi. <br> Haluaisitko, että <b>{person1} voi poistaa pisteitä</b> (vasemmalla) <u>vai</u> <b>{person2} voi poistaa pisteitä</b> (oikealla) vaiheessa 2?","Ikaw ay Tao A o Tao B, ngunit hindi mo alam kung alin. <br> Mas gusto mo ba na <b>{person1} ay maaaring mag-alis ng mga puntos</b> (kaliwa) <u>o</u> <b>{person2} ay maaaring mag-alis ng mga puntos</b> (kanan) sa Stage 2?","Είστε είτε το πρόσωπο Α είτε το πρόσωπο Β, αλλά δεν ξέρετε ποιο. <br> Θα προτιμούσατε το <b>{person1} να μπορεί να αφαιρέσει πόντους</b> (αριστερά) <u>ή</u> <b>{person2} μπορεί να αφαιρέσει πόντους</b> (δεξιά) στο Στάδιο 2;","आप या तो व्यक्ति A हैं या व्यक्ति B, लेकिन आप नहीं जानते कि कौन सा। <br> क्या आप चाहेंगे कि चरण 2 में <b>{person1} अंक हटा सके</b> (बाएं) <u>या</u> <b>{person2} अंक हटा सके</b> (दाएं)?","Te vagy A vagy B személy, de nem tudod, melyik. <br> Szeretné, ha <b>{person1} eltávolíthatna pontokat</b> (balra) <u>vagy</u> <b>{person2} eltávolíthat pontokat</b> (jobbra) a 2. szakaszban?","Anda adalah Orang A atau Orang B, tetapi Anda tidak tahu yang mana. <br> Apakah Anda lebih suka jika <b>{person1} dapat menghapus poin</b> (kiri) <u>atau</u> <b>{person2} dapat menghapus poin</b> (kanan) di Tahap 2?","Sei la Persona A o la Persona B, ma non sai quale delle due. <br> Preferiresti che <b>{person1} potesse rimuovere punti</b> (sinistra) <u>o</u> <b>{person2} potesse rimuovere punti</b> (destra) nella Fase 2?",あなたは人物 A か人物 B のどちらかですが、どちらかわかりません。<br>ステージ 2 では、<b>{person1} がポイントを削除できる</b> (左) <u>または</u> <b>{person2} がポイントを削除できる</b> (右) のどちらが好みですか?,"당신은 A씨 또는 B씨이지만, 어느 쪽인지는 알 수 없습니다. <br> 2단계에서 <b>{person1}이 포인트를 차감할 수 있는 것</b> (왼쪽) <u>또는</u> <b>{person2}가 포인트를 차감할 수 있는 것</b> (오른쪽)을 선호하시나요?","Anda sama ada Orang A atau Orang B, tetapi anda tidak tahu yang mana satu. <br> Adakah anda lebih suka <b>{person1} boleh mengalih keluar mata</b> (kiri) <u>atau</u> <b>{person2} boleh mengalih keluar mata</b> (kanan) dalam Peringkat 2?","Você é a Pessoa A ou a Pessoa B, mas não sabe qual delas. <br> Você prefere que <b>{person1} possa remover pontos</b> (esquerda) <u>ou</u> <b>{person2} possa remover pontos</b> (direita) no Estágio 2?","Jesteś Osobą A lub Osobą B, ale nie wiesz, którą z nich. <br>Czy wolałbyś, aby <b>{person1} mogła usuwać punkty</b> (po lewej) <u>czy</u> <b>{person2} mogła usuwać punkty</b> (po prawej) w etapie 2?","Sunteți fie Persoana A, fie Persoana B, dar nu știți care dintre ele. <br> Ați prefera ca <b>{person1} să poată elimina puncte</b> (stânga) <u>sau</u> <b>{person2} să poată elimina puncte</b> (dreapta) în Etapa 2?","Вы либо Человек А, либо Человек Б, но не знаете, кто именно. <br> Вы бы предпочли, чтобы <b>{person1} мог снимать баллы</b> (слева) <u>или</u> <b>{person2} мог снимать баллы</b> (справа) на этапе 2?","Eres la Persona A o la Persona B, pero no sabes cuál de ellas es. ¿Preferirías que <b>{persona1} pueda quitar puntos</b> (izquierda) <u>o</u> <b>{persona2} pueda quitar puntos</b> (derecha) en la Etapa 2?","Wewe ni Mtu A au Mtu B, lakini hujui ni yupi. <br> Je, ungependa <b>{person1} aweze kuondoa pointi</b> (kushoto) <u>au</u> <b>{person2} aweze kuondoa pointi</b> (kulia) katika Hatua ya 2?","Du är antingen person A eller person B, men du vet inte vilken. <br> Skulle du föredra att <b>{person1} kan ta bort poäng</b> (vänster) <u>eller</u> <b>{person2} kan ta bort poäng</b> (höger) i steg 2?",คุณคือบุคคล A หรือบุคคล B แต่คุณไม่ทราบว่าเป็นบุคคลใด <br> คุณต้องการให้ <b>{person1} ลบคะแนน</b> (ซ้าย) <u>หรือ</u> <b>{person2} ลบคะแนน</b> (ขวา) ในขั้นตอนที่ 2 หรือไม่,"Siz ya Kişi A'sınız ya da Kişi B'siniz, ancak hangisi olduğunuzu bilmiyorsunuz. <br> 2. Aşamada <b>{person1}'in puanları kaldırabilmesini</b> (sol) <u>veya</u> <b>{person2}'nin puanları kaldırabilmesini</b> (sağ) mi tercih edersiniz?","Ви або Особа А, або Особа Б, але ви не знаєте, яка саме. <br> Ви віддаєте перевагу, щоб <b>{person1} міг видаляти бали</b> (ліворуч) <u>чи</u> <b>{person2} міг знімати бали</b> (праворуч) на етапі 2?","Bạn là Người A hoặc Người B, nhưng bạn không biết là ai. <br> Bạn muốn <b>{person1} có thể xóa điểm</b> (trái) <u>hay</u> <b>{person2} có thể xóa điểm</b> (phải) trong Giai đoạn 2?"
2PP vs 3PP,pref_2PP_3PPB,,<b>{person}</b>&nbsp; can remove points.,<b>{person}</b>&nbsp; peut retirer des points.,<b>{person}</b>&nbsp; kann Punkte abziehen.,<b>{person}</b>&nbsp; يمكنه إزالة النقاط.,<b>{person}</b>&nbsp; може да премахва точки.,<b>{person} 可以删除积分。,,<b>{osoba}</b>&nbsp; može ukloniti bodove.,<b>{henkilö}</b>&nbsp; voi poistaa pisteitä.,<b>{tao}</b>&nbsp; maaaring mag-alis ng mga puntos.,<b>{person}</b>&nbsp; μπορεί να αφαιρέσει σημεία.,<b>{person}</b>&nbsp; अंक हटा सकते हैं.,<b>{személy}</b>&nbsp; pontokat távolíthat el.,<b>{person}</b>&nbsp; dapat menghapus poin.,<b>{person}</b>&nbsp; può rimuovere punti.,<b>{person} はポイントを削除できます。,<b>{person</b>&nbsp;은 포인트를 차감할 수 있습니다.,<b>{orang}</b>&nbsp; boleh keluarkan mata.,<b>{person}</b>&nbsp; pode remover pontos.,<b>{person}</b> może usuwać punkty.,<b>{persoană}</b>&nbsp; poate elimina puncte.,<b>{person}</b>&nbsp; может снимать баллы.,<b>{person}</b>&nbsp; puede eliminar puntos.,<b>{mtu}</b>&nbsp; inaweza kuondoa pointi.,<b>{person}</b>&nbsp; kan ta bort poäng.,<b>{person}</b>&nbsp; สามารถลบคะแนนได้,<b>{person}</b>&nbsp; puanları kaldırabilir.,<b>{person}</b>&nbsp; може зняти бали.,<b>{person}</b>&nbsp; có thể xóa điểm.
2PP vs 3PP,or_button,,OR,OU,ODER,أو,ИЛИ,或者,,ILI,TAI,O,Ή,या,VAGY,ATAU,O,または,또는,ATAU,OU,LUB,SAU,ИЛИ,O,AU,ELLER,หรือ,VEYA,АБО,HOẶC
Filler block 2a,filler2a_title,,Start of Block 2,Début du bloc 2,Beginn von Block 2,بداية الكتلة 2,Начало на блок 2,第 2 区块的开始,,Početak bloka 2,Lohkon 2 alku,Simula ng Block 2,Έναρξη του μπλοκ 2,ब्लॉक 2 की शुरुआत,A 2. blokk kezdete,Awal Blok 2,Inizio del Blocco 2,ブロック2の開始,블록 2의 시작,Permulaan Blok 2,Início do Bloco 2,Początek bloku 2,Începutul blocului 2,Начало блока 2,Inicio del Bloque 2,Mwanzo wa Block 2,Start av block 2,จุดเริ่มต้นของบล็อกที่ 2,2. Bloğun Başlangıcı,Початок блоку 2,Bắt đầu Khối 2
Filler block 2a,filler2a_beginning,,"You are now <b> beginning the second block</b>, where you will make <b>additional</b> decisions, using your earned bonus points.","Vous <b>commencez maintenant le deuxième bloc</b>, où vous prendrez des décisions <b>supplémentaires</b> en utilisant vos points bonus déjà gagnés.","Sie <b> beginnen jetzt mit dem zweiten Block</b>, in dem Sie <b>zusätzliche</b> Entscheidungen treffen indem Sie Ihre gesammelten Bonuspunkte verwenden.",أنت الآن تبدأ المرحلة الثانية، حيث ستتخذ قرارات إضافية، باستخدام نقاط المكافأة التي حصلت عليها.,"Сега <b> започвате втория блок</b>, където ще вземете <b>допълнителни</b> решения, като използвате вашите спечелени бонус точки.",您现在<b>开始第二个区块</b>，在这里您将使用您赚取的奖励积分做出<b>额外</b>的决定。,,"Sada <b> započinjete drugi blok</b>, gdje ćete donositi <b>dodatne</b> odluke koristeći svoje zarađene bonus bodove.","Olet nyt <b> aloittamassa toista lohkoa</b>, jossa teet <b>lisäpäätöksiä</b> ansaitsemiesi bonuspisteiden avulla.","Ikaw ay <b> ngayon ay nagsisimula sa pangalawang bloke</b>, kung saan gagawa ka ng <b>karagdagang</b> mga pagpapasya, gamit ang iyong mga nakuhang puntos ng bonus.","Τώρα <b> ξεκινάτε το δεύτερο μπλοκ</b>, όπου θα λάβετε <b>πρόσθετες</b> αποφάσεις, χρησιμοποιώντας τους κερδισμένους πόντους μπόνους.","अब आप <b>दूसरे ब्लॉक की शुरुआत कर रहे हैं</b>, जहाँ आप अपने अर्जित बोनस अंकों का उपयोग करके <b>अतिरिक्त</b> निर्णय लेंगे।","Most <b>kezdi a második blokkot</b>, ahol <b>további</b> döntéseket hoz a megszerzett bónuszpontok felhasználásával.","Anda sekarang <b>memulai blok kedua</b>, di mana Anda akan membuat <b>keputusan</b> tambahan, menggunakan poin bonus yang Anda peroleh.","Ora stai <b>iniziando il secondo blocco</b>, in cui prenderai <b>ulteriori</b> decisioni, utilizzando i punti bonus guadagnati.",これで <b> 2 番目のブロック</b> が始まります。ここでは、獲得したボーナス ポイントを使用して <b> 追加の</b> 決定を下すことになります。,"이제 <b>두 번째 블록</b>을 시작하게 되었으며, 여기서 획득한 보너스 포인트를 사용하여 <b>추가</b> 결정을 내리게 됩니다.","Anda kini <b> memulakan blok kedua</b>, di mana anda akan membuat keputusan <b>tambahan</b>, menggunakan mata bonus yang anda perolehi.","Agora você está <b>começando o segundo bloco</b>, onde tomará decisões <b>adicionais</b>, usando os pontos de bônus ganhos.","Teraz <b>rozpoczynasz drugi blok</b>, w którym podejmiesz <b>dodatkowe</b> decyzje, wykorzystując zdobyte punkty bonusowe.","Acum <b> începeți al doilea bloc</b>, unde veți lua decizii <b>suplimentare</b>, folosind punctele bonus câștigate.","Сейчас вы <b> начинаете второй блок</b>, в котором вам предстоит принять <b>дополнительные</b> решения, используя заработанные бонусные баллы.","Ahora estás <b>comenzando el segundo bloque</b>, donde tomarás <b>decisiones</b> adicionales, utilizando los puntos de bonificación obtenidos.","Sasa <b> unaanza kizuizi cha pili</b>, ambapo utafanya <b>maamuzi ya ziada</b>, kwa kutumia pointi ulizopata za bonasi.","Du börjar nu <b> det andra blocket</b>, där du kommer att fatta <b>ytterligare</b> beslut med hjälp av dina intjänade bonuspoäng.",ตอนนี้คุณกำลัง<b>เริ่มต้นบล็อกที่สอง</b> ซึ่งคุณจะทำการตัดสินใจ<b>เพิ่มเติม</b>โดยใช้คะแนนโบนัสที่คุณได้รับ,Artık kazandığınız bonus puanları kullanarak <b>ek</b> kararlar alacağınız <b>ikinci bloğa</b> başlıyorsunuz.,"Зараз ви <b> починаєте другий блок</b>, де ви прийматимете <b>додаткові</b> рішення, використовуючи зароблені бонусні бали.","Bây giờ bạn đang <b>bắt đầu khối thứ hai</b>, nơi bạn sẽ đưa ra <b>các quyết định bổ sung</b> bằng cách sử dụng điểm thưởng kiếm được của mình."
Filler block 2a,filler2_selected,,"From Block 2, <b><u>one</u> situation</b> will be randomly selected to <b>determine your final bonus points</b>.","À partir du bloc 2, <b><u>une seule</u> situation</b> sera sélectionnée au hasard pour <b>déterminer vos points bonus finaux</b>.","Aus Block 2 wird <b><u>eine</u> Situation</b> nach dem Zufallsprinzip ausgewählt, um <b>Ihre endgültigen Bonuspunkte zu bestimmen</b>.",من المربع 2، سيتم اختيار <b><u>موقف واحد</u> بشكل عشوائي لتحديد نقاط المكافأة النهائية الخاصة بك.,"От блок 2, <b><u>една</u> ситуация</b> ще бъде избрана на случаен принцип, за да <b>определите вашите крайни бонус точки</b>.",从第 2 部分开始，将随机选择<b><u>一种</u>情况</b>来<b>确定您的最终奖励积分</b>。,,"Iz Bloka 2, <b><u>jedna</u> situacija</b> bit će nasumično odabrana da <b>odredi vaše konačne bonus bodove</b>.",Lohkosta 2 <b><u>yksi</u> tilanne</b> valitaan satunnaisesti <b>lopullisten bonuspisteiden määrittämiseksi</b>.,"Mula sa Block 2, <b><u>isang</u> sitwasyon</b> ay random na pipiliin upang <b>matukoy ang iyong mga huling bonus na puntos</b>.","Από το Μπλοκ 2, <b><u>μία</u> κατάσταση</b> θα επιλεγεί τυχαία για να <b>προσδιορίσει τους τελικούς σας πόντους μπόνους</b>.","ब्लॉक 2 से, <b><u>एक</u> स्थिति</b> को यादृच्छिक रूप से चुना जाएगा ताकि <b>आपके अंतिम बोनस अंक निर्धारित किए जा सकें</b>।",A 2. blokkból <b><u>egy</u> helyzet</b> kerül véletlenszerűen kiválasztásra a <b>végső bónuszpontok meghatározásához</b>.,"Dari Blok 2, <b><u>satu</u> situasi</b> akan dipilih secara acak untuk <b>menentukan poin bonus akhir Anda</b>.","Dal Blocco 2, verrà selezionata casualmente <b><u>una </u>situazione</b> per <b>determinare i tuoi punti bonus finali</b>.",ブロック 2 から <b><u>1 つの</u>状況</b>がランダムに選択され、<b>最終的なボーナス ポイントが決定</b>されます。,블록 2부터는 <b><u>하나</u>의 상황</b>이 무작위로 선택되어 <b>최종 보너스 포인트</b>가 결정됩니다.,"Dari Blok 2, <b><u>satu</u> situasi</b> akan dipilih secara rawak untuk <b>menentukan mata bonus akhir anda</b>.","Do Bloco 2, <b><u>uma</u> situação</b> será selecionada aleatoriamente para <b>determinar seus pontos de bônus finais</b>.","Z Bloku 2 <b><u>jedna</u> sytuacja</b> zostanie wybrana losowo, aby <b>ustalić liczbę końcowych punktów bonusowych</b>.","Din blocul 2, <b><u>o</u> situație</b> va fi selectată aleatoriu pentru a <b>determina punctele bonus finale</b>.","Из блока 2 <b><u>одна</u> ситуация</b> будет выбрана случайным образом, чтобы <b>определить ваши окончательные бонусные баллы</b>.","A partir del Bloque 2, se seleccionará <b><u>una</u> situación</b> al azar para <b>determinar sus puntos de bonificación finales</b>.","Kutoka kwenye Kitalu cha 2, <b><u>hali</u> moja</b> itachaguliwa bila mpangilio ili <b>kubaini pointi zako za mwisho za bonasi</b>.",Från block 2 kommer <b><u>en</u> situation</b> att väljas slumpmässigt för att <b>bestämma dina slutliga bonuspoäng</b>.,จากบล็อกที่ 2 สถานการณ์<b><u>หนึ่ง</u>สถานการณ์จะถูกเลือกแบบสุ่มเพื่อ<b>กำหนดคะแนนโบนัสสุดท้ายของคุณ</b>,"2. Bloktan, <b><u>bir</u> durum</b> rastgele seçilerek <b>son bonus puanlarınız</b> belirlenecektir.",З блоку 2 <b><u>одна</u> ситуація</b> буде випадково вибрана для <b>визначення ваших остаточних бонусних балів</b>.,"Từ Khối 2, <b><u>một</u> tình huống</b> sẽ được chọn ngẫu nhiên để <b>xác định điểm thưởng cuối cùng của bạn</b>."
Filler block 2a,filler2a_different,,The situations you will see are different from those in the first block.,Les situations que vous verrez sont différentes de celles du premier bloc.,"Die Situationen, die Sie sehen, unterscheiden sich von denen im ersten Block.",المواقف التي ستراها مختلفة عن تلك الموجودة في الكتلة الأولى.,"Ситуациите, които ще видите, са различни от тези в първия блок.",您将看到的情况与第一个区块中的情况不同。,,Situacije koje ćete vidjeti razlikuju se od onih u prvom bloku.,Näkemäsi tilanteet ovat erilaisia kuin ensimmäisessä lohkossa.,Ang mga sitwasyong makikita mo ay iba sa mga nasa unang bloke.,Οι καταστάσεις που θα δείτε είναι διαφορετικές από αυτές του πρώτου μπλοκ.,आप जो परिस्थितियाँ देखेंगे वे पहले खंड की परिस्थितियों से भिन्न हैं।,A látható helyzetek eltérnek az első blokkban szereplőktől.,Situasi yang akan Anda lihat berbeda dari situasi di blok pertama.,Le situazioni che vedrai sono diverse da quelle del primo blocco.,表示される状況は、最初のブロックのものとは異なります。,여러분이 보게 될 상황은 첫 번째 블록의 상황과 다릅니다.,Situasi yang anda akan lihat adalah berbeza daripada situasi di blok pertama.,As situações que você verá são diferentes daquelas do primeiro bloco.,"Sytuacje, które zobaczysz, będą się różnić od tych w pierwszym bloku.",Situațiile pe care le vei vedea sunt diferite de cele din primul bloc.,"Ситуации, которые вы увидите, отличаются от ситуаций в первом блоке.",Las situaciones que verás son diferentes a las del primer bloque.,Hali utakazoona ni tofauti na zile zilizo katika block ya kwanza.,Situationerna du kommer att se skiljer sig från dem i det första blocket.,สถานการณ์ที่คุณจะเห็นนั้นแตกต่างจากในบล็อคแรก,Göreceğiniz durumlar ilk bloktakilerden farklıdır.,"Ситуації, які ви побачите, відрізняються від тих у першому блоці.",Những tình huống bạn sẽ thấy sẽ khác với những tình huống trong khối đầu tiên.
rule following,rule_instru,,"In this part, you decide how to position three sliders.","Dans cette partie, vous décidez comment positionner trois curseurs.","In diesem Teil entscheiden Sie, wie drei Schieberegler positioniert werden.",في هذا الجزء، عليك أن تقرر كيفية وضع ثلاثة منزلقات.,В тази част вие решавате как да позиционирате три плъзгача.,在这部分中，您将决定如何定位三个滑块。,,U ovom dijelu odlučujete kako ćete postaviti tri klizača.,"Tässä osassa päätät, kuinka kolme liukusäädintä sijoitetaan.","Sa bahaging ito, magpapasya ka kung paano iposisyon ang tatlong slider.","Σε αυτό το μέρος, αποφασίζετε πώς να τοποθετήσετε τρία ρυθμιστικά.","इस भाग में, आप तय करते हैं कि तीन स्लाइडर्स को किस प्रकार रखा जाए।","Ebben a részben Ön dönti el, hogyan helyezzen el három csúszkát.","Pada bagian ini, Anda memutuskan cara memposisikan tiga slider.","In questa parte, puoi decidere come posizionare tre cursori.",この部分では、3 つのスライダーの配置方法を決定します。,이 부분에서는 세 개의 슬라이더를 어떻게 배치할지 결정합니다.,"Dalam bahagian ini, anda memutuskan cara meletakkan tiga peluncur.","Nesta parte, você decide como posicionar três controles deslizantes.","W tej części zdecydujesz, jak ustawić trzy suwaki.","În această parte, decideți cum să poziționați trei glisoare.","В этой части вы решаете, как расположить три ползунка.","En esta parte, decide cómo posicionar tres controles deslizantes.","Katika sehemu hii, unaamua jinsi ya kuweka vitelezi vitatu.",I den här delen bestämmer du hur du ska placera tre skjutreglage.,ในส่วนนี้คุณจะต้องตัดสินใจว่าจะวางตำแหน่งสไลเดอร์ทั้งสามตัวอย่างไร,Bu bölümde üç kaydırıcının nasıl konumlandırılacağına karar vereceksiniz.,"У цій частині ви вирішуєте, як розмістити три повзунки.","Trong phần này, bạn sẽ quyết định cách đặt ba thanh trượt."
