page,key,translation_notes,en,fr,de,ar,bg,zh-CN,zh-TW,hr,fi,tl,el,hi,hu,id,it,ja,ko,ms,pt,pl,ro,ru,es,sw,sv,th,tr,uk,vi
demographics,ladder_intro,,"Imagine this 10 step ladder represents the socio-economic distribution in your country. At the top of the ladder are the people who are the best off, those who have the most money, most education, and best jobs. At the bottom are the people who are the worst off, those who have the least money, least education, worst jobs, or no job. Please click on the rung that best represents where you think you stand on the ladder.","Imaginez que cette échelle à 10 échelons représente la répartition socio-économique de votre pays. En haut se trouvent les personnes les plus aisées, celles qui ont le plus d'argent, le plus d'éducation et les meilleurs emplois. En bas se trouvent les personnes les plus défavorisées, celles qui ont le moins d'argent, le moins d'éducation, les pires emplois ou qui n'ont pas d'emploi. Veuillez cliquer sur l'échelon qui représente le mieux votre position sur l'échelle.","Stellen Sie sich vor, diese zehnstufige Leiter repräsentiert die sozioökonomische Verteilung in Ihrem Land. Oben auf der Leiter stehen die wohlhabendsten Menschen mit dem höchsten Einkommen, der höchsten Bildung und den besten Jobs. Unten stehen die Menschen mit dem geringsten Einkommen, der geringsten Bildung, den schlechtesten Jobs oder gar keiner Arbeit. Bitte klicken Sie auf die Sprosse, die am besten darstellt, wo Sie sich auf der Leiter sehen.",تخيل أن هذا السلم ذو الدرجات العشر يمثل التوزيع الاجتماعي والاقتصادي في بلدك. في أعلى السلم، تجد الميسورين، أصحاب المال، والتعليم، والوظائف الأفضل. في أسفله، تجد الأسوأ حالاً، أصحاب المال، والتعليم، والوظائف الأسوأ، أو العاطلين عن العمل. انقر على الدرجة التي تمثل وضعك على السلم برأيك.,"Представете си, че тази стълба от 10 стъпала представлява социално-икономическото разпределение във вашата страна. На върха на стълбата са хората, които са най-добре, тези, които имат най-много пари, най-много образование и най-добра работа. На дъното са хората, които са в най-зле, тези, които имат най-малко пари, най-малко образование, най-лошите работни места или нямат работа. Моля, щракнете върху стъпалото, което най-добре представя къде мислите, че стоите на стълбата.",想象一下，这十级阶梯代表了你所在国家的社会经济分布。梯子的顶端是境况最好的人，他们拥有最多的钱、最高的教育程度和最好的工作。梯子的底部是境况最差的人，他们拥有最少的钱、最低的教育程度、最差的工作或没有工作。请点击最能代表你认为自己在梯子上所处位置的梯级。,,"Zamislite da ova ljestvica od 10 koraka predstavlja društveno-ekonomsku distribuciju u vašoj zemlji. Na vrhu ljestvice su ljudi koji su najbolji, oni koji imaju najviše novca, najviše obrazovanja i najbolje poslove. Na dnu su ljudi koji su najgore, oni koji imaju najmanje novca, najmanje obrazovanja, imaju najgore poslove ili nemaju posao. Kliknite na prečku koja najbolje predstavlja gdje mislite da stojite na ljestvama.","Kuvittele, että nämä 10-portaiset tikkaat edustavat sosioekonomista jakautumista maassasi. Tikkaiden huipulla ovat ihmiset, joilla on parhaat mahdollisuudet, ne, joilla on eniten rahaa, eniten koulutusta ja parhaat työt. Pohjassa ovat ihmiset, joilla on huonoin tilanne, ne, joilla on vähiten rahaa, vähiten koulutusta, huonoimpia työpaikkoja tai ei yhtään työtä. Napsauta puolta, joka parhaiten edustaa paikkaa tikkailla.","Isipin na ang 10 hakbang na hagdan na ito ay kumakatawan sa sosyo-ekonomikong pamamahagi sa iyong bansa. Sa tuktok ng hagdan ay ang mga taong pinakamahuhusay, ang may pinakamaraming pera, pinakamaraming edukasyon, at pinakamahuhusay na trabaho. Sa ibaba ay ang mga taong pinakamasama ang kalagayan, ang may pinakamaliit na pera, hindi gaanong edukasyon, pinakamasamang trabaho, o walang trabaho. Mangyaring mag-click sa baitang na pinakamahusay na kumakatawan sa kung saan sa tingin mo ay nakatayo ka sa hagdan.","Φανταστείτε ότι αυτή η σκάλα 10 βημάτων αντιπροσωπεύει την κοινωνικοοικονομική κατανομή στη χώρα σας. Στην κορυφή της σκάλας βρίσκονται οι άνθρωποι που έχουν τα καλύτερα, αυτοί που έχουν τα περισσότερα χρήματα, την περισσότερη εκπαίδευση και τις καλύτερες δουλειές. Στο κάτω μέρος βρίσκονται οι άνθρωποι που έχουν τα χειρότερα, αυτοί που έχουν τα λιγότερα χρήματα, τη λιγότερη εκπαίδευση, τις χειρότερες δουλειές ή δεν έχουν δουλειά. Κάντε κλικ στο σκαλί που αντιπροσωπεύει καλύτερα το σημείο που νομίζετε ότι βρίσκεστε στη σκάλα.","कल्पना कीजिए कि यह दस सीढ़ियों वाली सीढ़ी आपके देश के सामाजिक-आर्थिक वितरण को दर्शाती है। सीढ़ी के सबसे ऊपर वे लोग हैं जो सबसे बेहतर स्थिति में हैं, जिनके पास सबसे ज़्यादा पैसा, सबसे ज़्यादा शिक्षा और सबसे अच्छी नौकरियाँ हैं। सबसे नीचे वे लोग हैं जो सबसे ज़्यादा बदहाल हैं, जिनके पास सबसे कम पैसा, सबसे कम शिक्षा, सबसे खराब नौकरियाँ या कोई नौकरी नहीं है। कृपया उस पायदान पर क्लिक करें जो आपके अनुसार सीढ़ी पर आपकी स्थिति को सबसे अच्छी तरह दर्शाता है।","Képzelje el, hogy ez a 10 lépcsős létra az Ön országának társadalmi-gazdasági megoszlását reprezentálja. A létra tetején azok állnak, akiknek a legjobb a helyzetük, akiknek a legtöbb pénzük van, a legtöbb képzettségük és a legjobb állásuk van. A legalsó helyen azok vannak, akiknek a legrosszabb helyzetük van, akiknek a legkevesebb pénzük, legkevesebb képzettségük, legrosszabb állásuk van, vagy nincs munkájuk. Kérjük, kattintson arra a létrafokra, amely a legjobban jelzi, hogy Ön szerint hol áll a létrán.","Bayangkan tangga 10 anak tangga ini mewakili distribusi sosial-ekonomi di negara Anda. Di puncak tangga adalah orang-orang yang paling makmur, mereka yang memiliki uang terbanyak, pendidikan terbanyak, dan pekerjaan terbaik. Di bagian bawah adalah orang-orang yang paling miskin, mereka yang memiliki uang paling sedikit, pendidikan paling rendah, pekerjaan terburuk, atau tidak memiliki pekerjaan. Silakan klik anak tangga yang paling mewakili posisi Anda di tangga tersebut.","Immagina che questa scala a 10 gradini rappresenti la distribuzione socio-economica del tuo Paese. In cima alla scala ci sono le persone che stanno meglio, quelle con più soldi, più istruzione e i lavori migliori. In fondo ci sono le persone che stanno peggio, quelle con meno soldi, meno istruzione, i lavori peggiori o senza lavoro. Clicca sul gradino che meglio rappresenta la tua posizione sulla scala.",この10段のはしごがあなたの国の社会経済的分布を表していると想像してみてください。はしごの一番上には、最も裕福な人々、つまり最も多くのお金、最も高い教育、そして最も良い仕事に就いている人々がいます。一番下には、最も貧しい人々、つまり最も少ないお金、最も低い教育、最も悪い仕事、あるいは無職の人々がいます。あなたがこのはしごのどの位置にいるのか、最もよく当てはまると思う段をクリックしてください。,"이 10단계 사다리가 여러분 나라의 사회경제적 분포를 나타낸다고 상상해 보세요. 사다리 꼭대기에는 가장 부유한 사람들, 가장 많은 돈을 가지고, 가장 높은 교육을 받고, 가장 좋은 직업을 가진 사람들이 있습니다. 사다리 아래에는 가장 가난한 사람들, 가장 적은 돈을 가지고, 가장 낮은 교육을 받고, 가장 나쁜 직업을 가지고, 또는 직업이 없는 사람들이 있습니다. 사다리에서 당신의 위치를 가장 잘 나타내는 칸을 클릭해 주세요.","Bayangkan tangga 10 langkah ini mewakili taburan sosio-ekonomi di negara anda. Di bahagian atas tangga adalah orang yang terbaik, mereka yang mempunyai wang paling banyak, paling banyak pendidikan, dan pekerjaan terbaik. Di bahagian bawah adalah orang yang paling teruk, mereka yang mempunyai wang paling sedikit, pendidikan paling sedikit, pekerjaan paling teruk, atau tiada pekerjaan. Sila klik pada anak tangga yang paling sesuai mewakili tempat yang anda fikir anda berdiri di atas tangga.","Imagine que esta escada de 10 degraus representa a distribuição socioeconômica em seu país. No topo da escada estão as pessoas mais bem-sucedidas, aquelas com mais dinheiro, mais educação e melhores empregos. Na base estão as pessoas mais desfavorecidas, aquelas com menos dinheiro, menos educação, piores empregos ou nenhuma ocupação. Clique no degrau que melhor representa sua posição na escada.","Wyobraź sobie, że ta 10-stopniowa drabina przedstawia rozkład społeczno-ekonomiczny w Twoim kraju. Na szczycie drabiny znajdują się osoby w najlepszej sytuacji, te, które mają najwięcej pieniędzy, najlepsze wykształcenie i najlepszą pracę. Na dole znajdują się osoby w najgorszej sytuacji, te, które mają najmniej pieniędzy, najgorsze wykształcenie, najgorszą pracę lub nie mają pracy. Kliknij szczebel, który najlepiej odzwierciedla Twoje miejsce na drabinie.","Imaginează-ți că această scară cu 10 trepte reprezintă distribuția socio-economică din țara ta. În vârful scării se află oamenii care sunt cei mai buni, cei care au cei mai mulți bani, cea mai mare educație și cele mai bune locuri de muncă. În partea de jos se află oamenii care sunt cele mai proaste, cei care au cei mai puțini bani, mai puțin educație, cele mai proaste locuri de muncă sau fără loc de muncă. Dați clic pe treapta care reprezintă cel mai bine locul în care credeți că vă aflați pe scară.","Представьте, что эта десятиступенчатая лестница отражает социально-экономическое распределение в вашей стране. Наверху лестницы находятся наиболее обеспеченные люди, те, у кого больше всего денег, больше всего образования и лучшая работа. Внизу — наименее обеспеченные люди, те, у кого меньше всего денег, меньше всего образования, худшая работа или вообще нет работы. Нажмите на ступеньку, которая, по вашему мнению, лучше всего отражает ваше положение на лестнице.","Imagina que esta escalera de 10 peldaños representa la distribución socioeconómica de tu país. En la cima se encuentran las personas más pudientes: quienes tienen más dinero, mayor educación y mejores empleos. En la base se encuentran las personas más desfavorecidas: quienes tienen menos dinero, menor educación, peores empleos o ningún empleo. Haz clic en el peldaño que mejor represente tu posición en la escalera.","Hebu fikiria ngazi hii ya hatua 10 inawakilisha usambazaji wa kijamii na kiuchumi katika nchi yako. Juu ya ngazi ni watu walio bora zaidi, walio na pesa nyingi, elimu nyingi, na kazi bora zaidi. Chini ni watu walio na hali mbaya zaidi, wale ambao wana pesa kidogo, elimu ndogo, kazi mbaya zaidi, au wasio na kazi. Tafadhali bofya safu inayowakilisha vyema zaidi pale unapofikiri umesimama kwenye ngazi.","Föreställ dig att denna 10-stegsstege representerar den socioekonomiska fördelningen i ditt land. Överst på stegen finns de människor som har det bäst, de som har mest pengar, mest utbildning och de bästa jobben. I botten finns de människor som har det sämst, de som har minst pengar, minst utbildning, sämst jobb eller inget jobb. Klicka på stegen som bäst representerar var du tror att du står på stegen.",ลองนึกภาพบันได 10 ขั้นนี้แสดงถึงการกระจายตัวทางเศรษฐกิจและสังคมในประเทศของคุณ ลำดับบนสุดของบันไดคือกลุ่มคนที่มีฐานะดีที่สุด คนที่มีเงินมากที่สุด การศึกษามากที่สุด และงานที่ดีที่สุด ส่วนลำดับล่างสุดคือกลุ่มคนที่ฐานะแย่ที่สุด คนที่มีเงินน้อยที่สุด การศึกษาน้อยที่สุด งานแย่ที่สุด หรือไม่มีงาน โปรดคลิกที่ขั้นบันไดที่แสดงถึงสถานะของคุณบนบันไดได้ดีที่สุด,"Bu 10 basamaklı merdivenin ülkenizdeki sosyo-ekonomik dağılımı temsil ettiğini düşünün. Merdivenin en üstünde en iyi durumda olanlar, en çok paraya, en iyi eğitime ve en iyi işlere sahip olanlar yer alır. En altta ise en kötü durumda olanlar, en az paraya, en az eğitime, en kötü işlere sahip olanlar veya hiç işsiz olanlar yer alır. Lütfen merdivende nerede durduğunuzu en iyi temsil eden basamağa tıklayın.","Уявіть, що ця 10-ступенева драбина відображає соціально-економічний розподіл у вашій країні. На вершині сходів знаходяться люди з найкращим становищем, ті, хто має найбільше грошей, найкращу освіту та найкращу роботу. Унизу знаходяться люди, які перебувають у найгіршому стані, ті, хто має найменше грошей, найменшу освіту, найгіршу роботу або взагалі не має роботи. Будь ласка, клацніть на сходинці, яка найкраще відображає, на вашу думку, ваше положення на драбині.","Hãy tưởng tượng thang bậc 10 bậc này đại diện cho sự phân bố kinh tế xã hội ở quốc gia bạn. Bậc trên cùng là những người có cuộc sống sung túc nhất, giàu có nhất, trình độ học vấn cao nhất và công việc tốt nhất. Bậc dưới cùng là những người có cuộc sống khó khăn nhất, ít tiền nhất, trình độ học vấn thấp nhất, công việc tệ nhất hoặc không có việc làm. Vui lòng nhấp vào bậc đại diện tốt nhất cho vị trí của bạn trên thang bậc."
demographics,ladder_question,,Where would you place yourself on this ladder?,Où vous placeriez-vous sur cette échelle ?,Wo würden Sie sich auf dieser Leiter platzieren?,أين تضع نفسك على هذا السلم؟,Къде бихте се поставили на тази стълба?,您会把自己置于这个梯子的什么位置？,,Gdje biste sebe smjestili na ovoj ljestvici?,Mihin sijoittaisit itsesi näillä tikkailla?,Saan mo ilalagay ang iyong sarili sa hagdan na ito?,Πού θα τοποθετούσατε τον εαυτό σας σε αυτή τη σκάλα;,इस सीढ़ी पर आप स्वयं को कहां रखेंगे?,Hol helyezné el magát ezen a létrán?,Di mana Anda akan menempatkan diri Anda pada tangga ini?,Dove ti collocheresti su questa scala?,あなたはこのはしごのどこに自分を位置づけますか?,당신은 이 사다리에서 어느 위치에 있을까요?,Di manakah anda akan meletakkan diri anda di tangga ini?,Onde você se colocaria nessa escada?,Jakie miejsce byś zajął na tej drabinie?,Unde te-ai pune pe scara asta?,Какое место на этой лестнице вы бы поместили?,¿Dónde te colocarías en esta escalera?,Ungejiweka wapi kwenye ngazi hii?,Var skulle du placera dig själv på den här stegen?,คุณจะวางตัวเองไว้ตรงไหนบนบันไดนี้?,Kendinizi bu basamakta nereye yerleştirirsiniz?,Де б ви розмістили себе на цій драбині?,Bạn sẽ xếp mình ở vị trí nào trên nấc thang này?
demographics,ladder_best_off,,"Best off (most money, education, jobs)","Les mieux lotis (plus d'argent, d'éducation, d'emplois)","Am besten (meistes Geld, Bildung, Arbeitsplätze)",أفضل حالاً (معظم المال والتعليم والوظائف),"Най-доброто (най-много пари, образование, работа)",条件最好（金钱、教育、工作最多）,,"Najbolje (najviše novca, obrazovanje, poslovi)","Parhaimmillaan (eniten rahaa, koulutusta, työpaikkoja)","Pinakamahusay (karamihan sa pera, edukasyon, trabaho)","Best off (περισσότερα χρήματα, εκπαίδευση, θέσεις εργασίας)","सबसे अच्छी स्थिति (सबसे अधिक धन, शिक्षा, नौकरी)","Legjobb helyzet (a legtöbb pénz, oktatás, munka)","Kondisi terbaik (uang, pendidikan, pekerjaan terbanyak)","La situazione migliore (più soldi, istruzione, lavoro)",最も恵まれている（最も多くのお金、教育、仕事）,"가장 좋은 조건(가장 많은 돈, 교육, 직업)","Terbaik (kebanyakan wang, pendidikan, pekerjaan)","Melhor situação (mais dinheiro, educação, empregos)","Najlepiej sytuowani (najwięcej pieniędzy, wykształcenia, pracy)","Cele mai bune beneficii (cei mai mulți bani, educație, locuri de muncă)","Лучший (больше всего денег, образования, работы)","Los más favorecidos (más dinero, educación, empleos)","Bora zaidi (pesa nyingi, elimu, kazi)","Bäst av (mest pengar, utbildning, jobb)",สิ่งที่ดีที่สุด (เงินส่วนใหญ่ การศึกษา งาน),"En iyi durumda olanlar (en çok para, eğitim, iş)","Найкраще (найбільше грошей, освіта, робота)","Tốt nhất (nhiều tiền nhất, giáo dục nhất, công việc nhất)"
demographics,ladder_worst_off,,"Worst off (least money, education, jobs)","Les plus démunis (moins d'argent, d'éducation, d'emplois)","Am schlechtesten (wenigstes Geld, Bildung, Arbeitsplätze)",الأسوأ حالاً (أقل المال والتعليم والوظائف),"Най-лошото (най-малко пари, образование, работа)",最差（金钱、教育和工作最少）,,"Najgore (najmanje novca, obrazovanja, poslova)","Huonoin (vähiten rahaa, koulutus, työpaikat)","Pinakamahina (hindi bababa sa pera, edukasyon, trabaho)","Η χειρότερη κατάσταση (λιγότερα χρήματα, εκπαίδευση, θέσεις εργασίας)","सबसे खराब स्थिति (कम पैसा, शिक्षा, नौकरियां)","A legrosszabb helyzetben (kevesebb pénz, oktatás, munkahely)","Yang paling buruk (paling sedikit uang, pendidikan, pekerjaan)","I peggiori (meno soldi, istruzione, lavoro)",最も恵まれない人々（お金、教育、仕事が最も少ない人々）,"가장 가난한 계층(돈, 교육, 일자리가 가장 적음)","Paling teruk (sekurang-kurangnya wang, pendidikan, pekerjaan)","Pior situação (menos dinheiro, educação, empregos)","Najgorsza sytuacja (najmniej pieniędzy, wykształcenia, pracy)","Cea mai proastă stare (mai puțini bani, educație, locuri de muncă)","Худшее положение (меньше всего денег, образования, работы)","Los más desfavorecidos (menos dinero, educación y empleo)","Mbaya zaidi (angalau pesa, elimu, kazi)","Sämst ställt (minst pengar, utbildning, jobb)",แย่ที่สุด (เงินน้อยที่สุด การศึกษาน้อยที่สุด งานน้อยที่สุด),"En kötü durumda olanlar (en az para, eğitim, iş)","Найгірше (найменше грошей, освіти, роботи)","Tệ nhất (ít tiền, ít giáo dục, ít việc làm)"
demographics,female,,Female,Femme,Weiblich,أنثى,женски,女性,,Žena,Naaras,Babae,Θηλυκός,महिला,Női,Perempuan,Femmina,女性,여성,perempuan,Fêmea,Kobieta,Femeie,Женский,Femenino,Mwanamke,Kvinnlig,หญิง,Dişi,Жінка,Nữ giới
demographics,male,,Male,Homme,Männlich,ذكر,мъжки,男性,,Muški,Uros,Lalaki,Αρσενικός,पुरुष,Férfi,Pria,Maschio,男,남성,jantan,Macho,Mężczyzna,Bărbat,Мужской,Masculino,Mwanaume,Manlig,ชาย,Erkek,Чоловік,Nam giới
demographics,other,,Other,Autre,Andere,آخر,други,其他,,ostalo,Muut,Iba pa,Αλλος,अन्य,Más,Lainnya,Altro,他の,다른,Lain-lain,Outro,Inny,Alte,Другой,Otro,Nyingine,Andra,อื่น,Diğer,інше,Khác
demographics,pnts,,Prefer not to say,Préfère ne pas dire,Möchte ich nicht angeben,أفضل عدم القول,Предпочитам да не казвам,不想说,,Radije ne reći,Mieluummin olla sanomatta,Mas piniling hindi sabihin,Προτιμήστε να μην πείτε,नहीं कहना पसंद करते हैं,Inkább ne mondjam,Lebih suka tidak mengatakannya,Preferisco non dirlo,言いたくない,말하고 싶지 않다,Lebih suka untuk tidak berkata,Prefiro não dizer,Wolę nie mówić,Prefer să nu spun,Предпочитаю не говорить,Prefiero no decirlo,Pendelea kutosema,Föredrar att inte säga,ไม่อยากพูด,Söylememeyi tercih ediyorum,Краще не говорити,Thà không nói
demographics,rural,"These are responses to the question ""Would you say you live in...?"". Please use the dative case, if applicable in your language. ",A rural area or village,Une zone rurale ou un village,Einer ländliche Gegend oder einem Dorf,منطقة ريفية أو قرية,Селски район или село,农村地区或村庄,,Ruralno područje ili selo,Maaseutu tai kylä,Isang rural na lugar o nayon,Αγροτική περιοχή ή χωριό,एक ग्रामीण क्षेत्र या गाँव,Vidéki terület vagy falu,Daerah pedesaan atau desa,Un'area rurale o un villaggio,田舎や村,시골 지역이나 마을,Kawasan luar bandar atau kampung,Uma área rural ou vila,Obszar wiejski lub wieś,O zonă rurală sau un sat,Сельская местность или деревня,Una zona rural o un pueblo,Eneo la kijijini au kijiji,Ett landsbygdsområde eller en by,พื้นที่ชนบทหรือหมู่บ้าน,Kırsal bir alan veya köy,Сільська місцевість або село,Một vùng nông thôn hoặc làng mạc
demographics,town,"These are responses to the question ""Would you say you live in...?"". Please use the dative case, if applicable in your language. ",A small or medium-sized town,Une petite ou moyenne ville,Einer kleinen oder mittelgroßen Stadt,مدينة صغيرة أو متوسطة الحجم,Малък или среден град,小型或中型城镇,,Mali ili srednji grad,Pieni tai keskikokoinen kaupunki,Isang maliit o katamtamang laki ng bayan,Μια μικρή ή μεσαία πόλη,एक छोटा या मध्यम आकार का शहर,Kis vagy közepes méretű város,Kota kecil atau menengah,Una città di piccole o medie dimensioni,小規模または中規模の町,작거나 중간 규모의 마을,Sebuah bandar kecil atau sederhana,Uma cidade pequena ou média,Małe lub średniej wielkości miasto,Un oraș mic sau mijlociu,Маленький или средний город,Una ciudad pequeña o mediana,Mji mdogo au wa kati,En liten eller medelstor stad,เมืองขนาดเล็กหรือขนาดกลาง,Küçük veya orta büyüklükte bir kasaba,Невелике або середнє місто,Một thị trấn nhỏ hoặc vừa
