page,key,translation_notes,en,fr,de,ar,bg,zh-CN,zh-TW,hr,fi,tl,el,hi,hu,id,it,ja,ko,ms,pt,pl,ro,ru,es,sw,sv,th,tr,uk,vi
Instructions,instru_2PP_stage2,,"<b>After</b> Person A makes their decision, <b>Stage 2</b> begins.","<b>Une fois que</b> la Personne A a pris sa décision, <b>l'étape 2</b> commence.","<b>Nachdem</b> Person A ihre Entscheidung getroffen hat, beginnt <b>Phase 2</b>.",<b>بعد</b> اتخاذ الشخص أ قراره، تبدأ <b>المرحلة الثانية</b>.,"<b>След като</b> Лице А вземе своето решение, започва <b>Етап 2</b>.",<b>在</b> A 做出决定之后，<b>第二阶段</b>开始。,,"<b>Nakon što</b> osoba A donese svoju odluku, počinje <b>Faza 2</b>.","<b>Kun</b> henkilö A on tehnyt päätöksensä, <b>2. vaihe</b> alkaa.","<b>Pagkatapos</b> gumawa ng desisyon ang Tao A, magsisimula ang <b>Stage 2</b>.","<b>Αφού</b> Το άτομο Α πάρει την απόφασή του, ξεκινά το <b>Στάδιο 2</b>.","<b>व्यक्ति A द्वारा अपना निर्णय लेने के बाद, <b>चरण 2</b> शुरू होता है।","<b>Miután</b> az A személy meghozza döntését, megkezdődik a <b>2. szakasz</b>.","<b>Setelah</b> Orang A membuat keputusannya, <b>Tahap 2</b> dimulai.","<b>Dopo</b> che la persona A ha preso la sua decisione, inizia la <strong>fase 2</strong>.",<b>後</b>に、Aさんが決断した後、<b>ステージ2</b>が始まります。,"A씨가 결정을 내린 후, <b>2단계</b>가 시작됩니다.","<b>Selepas</b> Orang A membuat keputusan mereka, <b>Tahap 2</b> bermula.","<b>Depois</b> que a Pessoa A toma sua decisão, o <b>Estágio 2</b> começa.","<b>Gdy</b> Osoba A podejmie decyzję, rozpoczyna się <b>Etap 2</b>.","<b>După ce</b> Persoana A ia decizia, începe <b>Etapa 2</b>.","<b>После</b> того, как человек А принял решение, начинается <b>этап 2</b>.","<b>Después</b> de que la Persona A toma su decisión, comienza la <b>Etapa 2</b>.","<b>Baada ya</b> Mtu A kufanya uamuzi wake, <b>Hatua ya 2</b> inaanza.",<b>När</b> Person A har fattat sitt beslut börjar <b>Steg 2</b>.,<b>หลังจากที่</b>บุคคล A ตัดสินใจแล้ว <b>ขั้นตอนที่ 2</b> ก็เริ่มขึ้น,Kişi A kararını verdikten sonra <b>2</b> Aşama başlar.,"<b>Після того, як</b> особа А прийме рішення, починається <b>Етап 2</b>.","<b>Sau khi</b> Người A đưa ra quyết định, <b>Giai đoạn 2</b> bắt đầu."
Instructions,instru_2PP_remove,,"In <b>Stage 2</b>, Person A and Person B both receive additional 4 points. Then, <b>Person B</b> can <b>remove points</b> from <b>Person A</b>. Removing <b>1 point</b> from Person A costs Person B <b>{cost_per_point} points</b>.","À <b>l'étape 2</b>, les Personnes A et B reçoivent chacune 4 points supplémentaires. Ensuite, la <b>Personne B</b> peut <b>retirer</b> des points à la <b>Personne A</b>. Retirer <b>1 point</b> à la Personne A coûte <b>{cost_per_point} points</b> à la Personne B.",In <b>Phase 2</b> erhalten Person A und Person B jeweils zusätzlich 4 Punkte. Anschließend kann <b>Person B</b> Punkte von <b>Person A</b> <b>abziehen</b>. Das Abziehen von <b>1 Punkt</b> von Person A kostet Person B <b> {cost_per_point} Punkte</b>.,في المرحلة الثانية، يحصل كلٌّ من الشخص أ والشخص ب على أربع نقاط إضافية. بعد ذلك، يمكن للشخص ب إزالة نقاط من الشخص أ. إزالة نقطة واحدة من الشخص أ يكلف الشخص ب {cost_per_point} نقطة.,В <b>Етап 2</b> Лице А и Лице Б получават допълнителни 4 точки. След това <b>лице Б</b> може да <b>премахне точки</b> от <b>лице А</b>. Премахването на <b>1 точка</b> от Лице А струва на Лице Б <b>{cost_per_point} точки</b>.,在<b>第二阶段</b>中，A 和 B 各自获得额外的 4 分。然后，<b>B 可以</b>从<b>A</b>身上<b>扣除分数</b>。从 A 身上扣除 <b>1 分</b>将使 B 损失 <b>{cost_per_point} 分</b>。,,"U <b>Fazi 2</b>, i osoba A i osoba B dobivaju dodatna 4 boda. Zatim, <b>Osoba B</b> može <b>ukloniti bodove</b> od <b>Osobe A</b>. Uklanjanje <b>1 boda</b> od osobe A košta osobu B <b>{cost_per_point} bodova</b>.",<b>Vaiheessa 2</b> henkilö A ja henkilö B saavat molemmat 4 lisäpistettä. Sitten <b>henkilö B</b> voi <b>poistaa pisteitä</b> <b>henkilöstä A</b>. <b>1 pisteen</b> poistaminen henkilöltä A maksaa henkilölle B <b>{cost_per_point} pistettä</b>.,"Sa <b>Stage 2</b>, ang Tao A at Tao B ay parehong nakakatanggap ng karagdagang 4 na puntos. Pagkatapos, <b>Taong B</b> ay maaaring <b>mag-alis ng mga puntos</b> mula sa <b>Tao A</b>. Ang pag-alis ng <b>1 puntos</b> mula sa Tao A ay nagkakahalaga ng Tao B ng <b>{cost_per_point} na puntos</b>.","Στο <b>Στάδιο 2</b>, το άτομο Α και το άτομο Β λαμβάνουν επιπλέον 4 βαθμούς. Στη συνέχεια, το <b>Άτομο Β</b> μπορεί να <b>αφαιρεί πόντους</b> από το <b>Άτομο Α</b>. Η κατάργηση <b>1 βαθμού</b> από το άτομο Α κοστίζει στο άτομο Β <b>{cost_per_point} πόντους</b>.","<b>चरण 2</b> में, व्यक्ति A और व्यक्ति B दोनों को अतिरिक्त 4 अंक मिलते हैं। फिर, <b>व्यक्ति B</b>, <b>व्यक्ति A</b> से <b>अंक हटा</b> सकता है। व्यक्ति A से <b>1 अंक</b> हटाने पर व्यक्ति B को <b>{cost_per_point} अंक</b> का नुकसान होगा।",A <b>2. szakaszban</b> az A személy és a B személy további 4 pontot kap. Ezután <b>B személy</b> <b>pontokat távolíthat el</b> <b>A személyről</b>. <b>1 pont</b> eltávolítása B személytől <b>{cost_per_point} pontba</b> kerül.,"Pada <b>Tahap 2</b>, Orang A dan Orang B sama-sama menerima tambahan 4 poin. Kemudian, <b>Orang B</b> dapat <b>menghapus poin</b> dari <b>Orang A</b>. Penghapusan <b>1 poin</b> dari Orang A akan mengurangi poin Orang B sebesar <b>{cost_per_point}.","Nella <b>Fase 2</b>, la Persona A e la Persona B ricevono entrambe 4 punti aggiuntivi. Quindi, la <b>Persona B</b> può <b>togliere punti</b> alla <b>Persona A</b>. Togliere <b>1 punto</b> alla Persona A costa alla Persona B <b> {cost_per_point} punti</b>.",<b>ステージ2</b>では、AさんとBさんはそれぞれ4ポイント追加されます。その後、<b>Bさん</b>は<b>Aさん</b>から<b>ポイントを減算</b>できます。Aさんから<b>1ポイント</b>減算するには、Bさんは<b>{cost_per_point}ポイント</b>を消費します。,<b>2단계</b>에서는 A와 B 모두 4점을 추가로 받습니다. 이후 <b>B</b>는 <b>A</b>에게서 <b>점수를 차감</b>할 수 있습니다. A에게서 <b>1점</b>을 차감하는 데 B는 <b>{cost_per_point}점</b>을 소모합니다.,"Dalam <b>Peringkat 2</b>, Orang A dan Orang B kedua-duanya menerima 4 mata tambahan. Kemudian, <b>Orang B</b> boleh <b>mengalih keluar mata</b> daripada <b>Orang A</b>. Mengalih keluar <b>1 mata</b> daripada Orang A kos Orang B <b>{cost_per_point} mata</b>.","No <b>Estágio 2</b>, a Pessoa A e a Pessoa B recebem 4 pontos adicionais. Então, a <b>Pessoa B</b> pode <b>remover pontos</b> da <b>Pessoa A</b>. Remover <b>1 ponto</b> da Pessoa A custa à Pessoa B <b>{cost_per_point} pontos</b>.",W <b>Etap 2</b> Osoba A i Osoba B otrzymują dodatkowo 4 punkty. Następnie <b>Osoba B</b> może <b>odebrać punkty</b> Osobie A. Odebranie <b>1 punktu</b> Osobie A kosztuje Osobę B <b>{cost_per_point} punktów</b>.,"În <b>Etapa 2</b>, Persoana A și Persoana B primesc ambele 4 puncte suplimentare. Apoi, <b>Persoana B</b> poate <b>elimina puncte</b> de la <b>Persoana A</b>. Eliminarea <b>1 punct</b> de la Persoana A costă Persoana B <b>{cost_per_point} puncte</b>.",На <b>этапе 2</b> человек A и человек B получают по 4 дополнительных очка. Затем человек B может <b>снять очки</b> с <b>человека A</b>. Снятие <b>1 очка</b> с человека A стоит человеку B <b>{cost_per_point} очков</b>.,"En la <b>Etapa 2</b>, tanto la Persona A como la Persona B reciben 4 puntos adicionales. Después, la <b>Persona B</b> puede quitarle puntos a la <b>Persona A</b>. Quitarle <b>1 punto</b> a la Persona A le cuesta a la Persona B <b>{costo por punto} puntos</b>.","Katika <b>Hatua ya 2</b>, Mtu A na Mtu B wote hupokea pointi 4 za ziada. Kisha, <b>Mtu B</b> anaweza <b>kuondoa pointi</b> kutoka kwa <b>Mtu A</b>. Kuondoa <b>pointi 1</b> kutoka kwa Mtu A kunagharimu Mtu B <b>pointi{cost_per_point}</b>.",I <b>steg 2</b> får både person A och person B ytterligare 4 poäng. Sedan kan <b>Person B</b> <b>ta bort poäng</b> från <b>Person A</b>. Att ta bort <b>1 poäng</b> från person A kostar person B <b>{cost_per_point} poäng</b>.,ใน<b>ระยะที่ 2</b> ทั้งบุคคล A และบุคคล B จะได้รับคะแนนเพิ่ม 4 คะแนน จากนั้น <b>บุคคล B</b> สามารถ<b>ถอนคะแนน</b>จากบุคคล A</b> ได้ การลบ <b>1 คะแนน</b> จากบุคคล A จะทำให้บุคคล B เสียคะแนน <b>{cost_per_point} คะแนน</b>,"<b>2. Aşama</b>'da, Kişi A ve Kişi B ek 4 puan alır. Ardından, Kişi B, Kişi A'dan <b>puan</b> çıkarabilir. Kişi A'dan <b>1 puan</b> çıkarmak, Kişi B'ye <b>{cost_per_point} puan</b> kaybettirir.",На <b>Етапі 2</b> Особа А та Особа Б отримують додаткові 4 бали. Тоді <b>Особа Б</b> може <b>зняти бали</b> з <b>Особи А</b>. Видалення <b>1 бала</b> від Особи А коштує Особі Б <b>{cost_per_point} балів</b>.,"Ở <b>Giai đoạn 2</b>, Người A và Người B đều nhận được thêm 4 điểm. Sau đó, <b>Người B</b> có thể <b>rút điểm</b> khỏi <b>Người A</b>. Việc rút <b>1 điểm</b> khỏi Người A sẽ khiến Người B mất <b>{cost_per_point} điểm</b>."
Instructions,instru_2PP_role,,"Depending on the situation, you can be Person A or Person B.","Selon la situation, vous pouvez être Personne A ou Personne B.",Je nach Situation können Sie Person A oder Person B sein.,اعتمادًا على الموقف، يمكنك أن تكون الشخص أ أو الشخص ب.,"В зависимост от ситуацията, можете да бъдете Лице А или Лице Б.",根据情况，您可以是 A 人或 B 人。,,"Ovisno o situaciji, možete biti osoba A ili osoba B.",Tilanteesta riippuen voit olla henkilö A tai henkilö B.,"Depende sa sitwasyon, maaari kang maging Person A o Person B.","Ανάλογα με την κατάσταση, μπορείτε να είστε το άτομο Α ή το άτομο Β.","स्थिति के आधार पर, आप व्यक्ति ए या व्यक्ति बी हो सकते हैं।",A helyzettől függően Ön A vagy B személy lehet.,"Tergantung pada situasinya, Anda bisa menjadi Orang A atau Orang B.","A seconda della situazione, potresti essere la Persona A o la Persona B.",状況に応じて、あなたはAさんにもBさんにもなれます。,상황에 따라 당신은 A라는 사람이 될 수도 있고 B라는 사람이 될 수도 있습니다.,"Bergantung pada situasi, anda boleh menjadi Orang A atau Orang B.","Dependendo da situação, você pode ser a Pessoa A ou a Pessoa B.",W zależności od sytuacji możesz być Osobą A lub Osobą B.,"În funcție de situație, poți fi Persoana A sau Persoana B.",В зависимости от ситуации вы можете быть Человеком А или Человеком Б.,"Dependiendo de la situación, puedes ser la Persona A o la Persona B.","Kulingana na hali, unaweza kuwa Mtu A au Mtu B.",Beroende på situationen kan du vara person A eller person B.,คุณสามารถเป็นบุคคล A หรือบุคคล B ได้ ขึ้นอยู่กับสถานการณ์,Duruma göre Kişi A veya Kişi B olabilirsiniz.,"Залежно від ситуації, ви можете бути Людиною А або Особою Б.","Tùy thuộc vào tình huống, bạn có thể là Người A hoặc Người B."
Instructions,instru_3PP_change,,Now there is one change.,"Maintenant, il y a un changement.",Jetzt gibt es eine Änderung.,الآن هناك تغيير واحد.,Сега има една промяна.,现在有一个变化。,,Sada postoji jedna promjena.,Nyt on yksi muutos.,Ngayon ay may isang pagbabago.,Τώρα υπάρχει μια αλλαγή.,अब एक परिवर्तन हुआ है।,Most egy változás történt.,Sekarang ada satu perubahan.,Ora c'è un cambiamento.,今、変更点が1つあります。,이제 한 가지 변화가 있습니다.,Sekarang ada satu perubahan.,Agora há uma mudança.,Teraz nastąpiła jedna zmiana.,Acum există o singură schimbare.,Теперь есть одно изменение.,Ahora hay un cambio.,Sasa kuna mabadiliko moja.,Nu är det en förändring.,ตอนนี้มีการเปลี่ยนแปลงหนึ่งอย่าง,Şimdi bir değişiklik var.,Тепер є одна зміна.,Bây giờ có một sự thay đổi.
Instructions,instru_3PP_personc,,There will be a third person: <b >Person C.</b>,Il y aura une troisième personne : <b >Personne C.</b>,Es wird eine dritte Person geben: <b >Person C.</b>,سيكون هناك شخص ثالث: <b>الشخص ج</b>,Ще има трето лице: <b>Лице C.</b>,将会有第三个人：<b>人 C.</b>,,Bit će tu i treća osoba: <b >Osoba C.</b>,Mukana on kolmas henkilö: <b >henkilö C.</b>,Magkakaroon ng ikatlong tao: <b >Tao C.</b>,Θα υπάρχει ένα τρίτο πρόσωπο: <b >Πρόσωπο Γ.</b>,एक तीसरा व्यक्ति होगा: <b>व्यक्ति C.</b>,Lesz egy harmadik személy: <b >C. személy</b>,Akan ada orang ketiga: <b >Orang C.</b>,Ci sarà una terza persona: <b>Persona C.</b>,3人目の人物は<b >人物 C</b>です。,세 번째 사람이 있을 겁니다: <b >C 사람.</b>,Akan ada orang ketiga: <b >Orang C.</b>,Haverá uma terceira pessoa: <b >Pessoa C.</b>,Będzie trzecia osoba: <b >Osoba C.</b>,Va fi o a treia persoană: <b >Persoana C.</b>,Будет третье лицо: <b >Лицо C.</b>,Habrá una tercera persona: <b>Persona C.</b>,Kutakuwa na mtu wa tatu: <b >Mtu C.</b>,Det kommer att finnas en tredje person: <b >Person C.</b>,จะมีบุคคลที่สามคือ: <b >บุคคล C.</b>,Üçüncü bir kişi daha olacak: <b >Kişi C.</b>,Буде третя особа: <b>Особа C.</b>,Sẽ có một người thứ ba: <b >Người C.</b>
Instructions,instru_3PP_remove,,"Person B is <u>not</u> able to remove points anymore. Instead, <b style='color: red; '>Person C</b> is able to <b>remove points</b> from Person A.","La Personne B ne peut <b>plus</b> retirer de points. En revanche, la <b style='color: red; '>Personne C</b> peut <b>retirer des points</b> à la Personne A.",Person B kann <u>keine</u> Punkte mehr abziehen. Stattdessen kann <b style='color: red; '>Person C</b>  <b>Punkte von Person A abziehen</b>.,لم يعد بإمكان الشخص ب إزالة النقاط. بدلاً من ذلك، يستطيع الشخص ج إزالة النقاط من الشخص أ.,"Човек B <u>не</u> вече може да премахва точки. Вместо това, <b style='color: red; '>Лице C</b> може да <b>премахва точки</b> от Лице A.",B 人 <u>无法</u>再扣分。相反，<b style='color: red; '>C 人</b> 可以 <b>扣分</b> 给 A 人。,,"Osoba B <u>nije</u> više u mogućnosti uklanjati bodove. Umjesto toga, <b style='color: red; '>Osoba C</b> može <b>ukloniti bodove</b> od osobe A.",Henkilö B <u>ei</u> voi enää poistaa pisteitä. Sen sijaan <b style='color: red; '>Henkilö C</b> pystyy <b>poistamaan pisteitä</b> henkilöstä A.,"Ang Tao B ay <u>hindi</u> na makapag-alis ng mga puntos. Sa halip, <b style='color: red; Ang '>Person C</b> ay maaaring <b>mag-alis ng mga puntos</b> mula sa Person A.","Το άτομο Β <u>δεν</u> μπορεί πλέον να αφαιρέσει πόντους. Αντίθετα, <b style='color: red; '>Το άτομο Γ</b> μπορεί να <b>αφαιρεί πόντους</b> από το άτομο Α.","व्यक्ति B अब पॉइंट्स नहीं हटा सकता। इसके बजाय, <b style='color: red; '>व्यक्ति C</b> व्यक्ति A के पॉइंट्स हटा सकता है।",B személy <u>nem</u> tud többé pontokat eltávolítani. Ehelyett <b style='color: red; '>C személy</b> képes <b>pontokat eltávolítani</b> A személyről.,"Orang B <u>tidak</u> bisa lagi menghapus poin. Sebaliknya, <b style='color: red; '>Orang C</b> bisa <b>menghapus poin</b> dari Orang A.","La persona B non è più in grado di rimuovere punti. Invece, la persona C può rimuovere punti dalla persona A.",Bさんは<u>ポイントを消すことができなくなりました</u>。代わりに、<b style='color: red; '>Cさん</b>がAさんから<b>ポイントを消す</b>ことができます。,"B는 더 이상 포인트를 제거할 수 없습니다. 대신, <b style='color: red; '>C</b>는 A의 포인트를 제거할 수 있습니다.","Orang B <u>tidak</u> dapat mengalih keluar mata lagi. Sebaliknya, <b style='color: red; '>Orang C</b> dapat <b>mengalih keluar mata</b> daripada Orang A.","A Pessoa B <u>não</u> consegue mais remover pontos. Em vez disso, a <b style='color: red; '>Pessoa C</b> consegue <b>remover pontos</b> da Pessoa A.",Osoba B <u>nie</u> może już usuwać punktów. Zamiast tego <b style='color: red; '>Osoba C</b> może <b>usuwać punkty</b> Osobie A.,"Persoana B <u>nu</u> mai poate elimina puncte. În schimb, <b style='color: red; „>Persoana C</b> poate <b>elimina puncte</b> de la Persoana A.",Человек B <u>больше не</u> может снимать очки. Вместо этого <b style='color: red; '>человек C</b> может <b>снимать очки</b> с человека A.,"La persona B ya no puede quitarle puntos. En cambio, la persona C sí puede quitarle puntos a la persona A.","Mtu B <u>hawezi</u> kuondoa pointi tena. Badala yake, <b style='color: red; '>Mtu C</b> ana uwezo <b>kuondoa pointi</b> kutoka kwa Mtu A.",Person B kan <u>inte</u> ta bort poäng längre. Istället <b style='color: red; '>Person C</b> kan <b>ta bort poäng</b> från person A.,บุคคล B <u>ไม่สามารถ</u> ลบคะแนนได้อีกต่อไป บุคคล C</b> สามารถ<b>ลบคะแนน</b> จากบุคคล A ได้,"Kişi B artık puan kaldıramıyor. Bunun yerine, Kişi C, Kişi A'dan puan kaldırabiliyor.",Особа Б більше <u>не</u> може знімати бали. Натомість <b style='color: red; '>Особа С</b> може <b>зняти бали</b> з Особи А.,"Người B <u>không</u> thể xóa điểm nữa. Thay vào đó, <b style='color: red; '>Người C</b> có thể <b>xóa điểm</b> khỏi Người A."
Instructions,instru_3PP_rules,,"In <b>Stage 2</b>, Person C receives additional 4 points. Removing <b>1 point</b> from Person A costs Person C <b>{cost_per_point}</b>. Removed points are eliminated.","À <b>l'étape 2</b>, la Personne C reçoit 4 points supplémentaires. Retirer <b>1 point</b> à la personne A lui coûte 1 <b>{cost_per_point}</b>. Les points retirés sont éliminés.",In <b>Phase 2</b> erhält Person C zusätzlich 4 Punkte. Das Abziehen von <b>1 Punkt</b> von Person A kostet Person C <b> {cost_per_point}</b>. Abgezogene Punkte verfallen.,في المرحلة الثانية، يحصل الشخص ج على ٤ نقاط إضافية. خسارة نقطة واحدة من الشخص أ تكلف الشخص ج {cost_per_point}، وتُلغى النقاط التي تُسحب منه.,В <b>Етап 2</b> Лице C получава допълнителни 4 точки. Премахването на <b>1 точка</b> от лице A струва на лице C <b>{cost_per_point}</b>. Отстранените точки се елиминират.,在<b>第 2 阶段</b>中，C 人额外获得 4 分。扣除 A 人<b>1 分</b>将使 C 人损失 <b>{cost_per_point}。扣除的分数将被淘汰。,,"U <b>2. fazi</b>, osoba C dobiva dodatna 4 boda. Uklanjanje <b>1 boda</b> od osobe A košta osobu C <b>{cost_per_point}</b>. Uklonjeni bodovi se eliminiraju.",<b>Vaiheessa 2</b> henkilö C saa 4 lisäpistettä. <b>1 pisteen</b> poistaminen henkilöltä A maksaa henkilölle C <b>{cost_per_point}</b>. Poistetut pisteet eliminoidaan.,"Sa <b>Stage 2</b>, nakakatanggap ang Tao C ng karagdagang 4 na puntos. Ang pag-alis ng <b>1 puntos</b> mula sa Tao A ay nagkakahalaga ng Tao C ng <b>{cost_per_point}</b>. Ang mga inalis na puntos ay tinanggal.","Στο <b>Στάδιο 2</b>, το άτομο Γ λαμβάνει επιπλέον 4 βαθμούς. Η κατάργηση <b>1 βαθμού</b> από το άτομο Α κοστίζει στο άτομο Γ <b>{cost_per_point}</b>. Τα σημεία που αφαιρέθηκαν εξαλείφονται.","<b>चरण 2</b> में, व्यक्ति C को अतिरिक्त 4 अंक मिलते हैं। व्यक्ति A से <b>1 अंक</b> हटाने पर व्यक्ति C को <b>{cost_per_point}</b> का खर्च आता है। हटाए गए अंक रद्द कर दिए जाते हैं।",A <b>2. szakaszban</b> a C személy további 4 pontot kap. <b>1 pont</b> eltávolítása A személytől <b>{cost_per_point}</b> költséget jelent C személynek. Az eltávolított pontok megszűnnek.,"Pada <b>Tahap 2</b>, Orang C menerima tambahan 4 poin. Penghapusan <b>1 poin</b> dari Orang A akan dikenakan biaya <b>{cost_per_point}</b> kepada Orang C. Poin yang dihapus akan dieliminasi.","Nella <b>Fase 2</b>, la Persona C riceve 4 punti aggiuntivi. Togliere <b>1 punto</b> alla Persona A costa alla Persona C <b>{cost_per_point}</b>. I punti rimossi vengono eliminati.",<b>ステージ2</b>では、Cさんはさらに4ポイントを獲得します。Aさんから<b>1ポイント</b>を差し引くには、Cさんは<b>{cost_per_point}かかります。差し引かれたポイントは消滅します。,<b>2단계</b>에서 C는 4점을 추가로 받습니다. A에게서 <b>1점</b>을 삭감하면 C는 <b>{cost_per_point</b>의 비용이 발생합니다. 삭감된 점수는 소멸됩니다.,"Dalam <b>Peringkat 2</b>, Orang C menerima 4 mata tambahan. Mengalih keluar <b>1 mata</b> daripada Orang A kos Orang C <b>{cost_per_point}</b>. Mata yang dialih keluar dihapuskan.","No <b>Estágio 2</b>, a Pessoa C recebe 4 pontos adicionais. Remover <b>1 ponto</b> da Pessoa A custa à Pessoa C <b>{custo_por_ponto}</b>. Os pontos removidos são eliminados.",W <b>Etap 2</b> Osoba C otrzymuje dodatkowe 4 punkty. Odebranie <b>1 punktu</b> Osobie A kosztuje Osobę C <b>{cost_per_point</b>. Odebrane punkty są odejmowane.,"În <b>Etapa 2</b>, Persoana C primește 4 puncte suplimentare. Eliminarea <b>1 punct</b> de la Persoana A o costă pe Persoana C <b>{cost_per_point}</b>. Punctele eliminate sunt eliminate.",На <b>этапе 2</b> человек C получает дополнительные 4 очка. Снятие <b>1 очка</b> с человека A стоит человеку C <b>{cost_per_point}</b>. Снятые очки аннулируются.,"En la <b>Etapa 2</b>, la Persona C recibe 4 puntos adicionales. Quitarle <b>1 punto</b> a la Persona A le cuesta a la Persona C <b>{costo por punto}</b>. Los puntos quitados se eliminan.","Katika <b>Hatua ya 2</b>, Mtu C hupokea pointi 4 za ziada. Kuondoa <b>pointi 1</b> kutoka kwa Mtu A kunagharimu Mtu C <b>{cost_per_point}</b>. Pointi zilizoondolewa huondolewa.",I <b>steg 2</b> får person C ytterligare 4 poäng. Att ta bort <b>1 poäng</b> från person A kostar person C <b>{cost_per_point}</b>. Borttagna poäng elimineras.,ใน <b>ระยะที่ 2</b> บุคคล C จะได้รับคะแนนเพิ่ม 4 คะแนน การลบ <b>1 คะแนน</b> จากบุคคล A จะทำให้บุคคล C เสียคะแนน <b>{cost_per_point}</b> คะแนนที่ถูกลบจะถูกตัดออก,"<b>2. Aşama</b>'da, Kişi C ek 4 puan alır. Kişi A'dan <b>1 puan</b> çıkarmak, Kişi C'ye <b>{cost_per_point}</b> maliyeti çıkarır. Çıkarılan puanlar elenir.",На <b>Етапі 2</b> особа C отримує додаткові 4 бали. Вилучення <b>1 бала</b> з особи A коштує людині C <b>{cost_per_point}</b>. Видалені бали елімінуються.,"Ở <b>Giai đoạn 2</b>, Người C nhận thêm 4 điểm. Việc trừ <b>1 điểm</b> khỏi Người A sẽ khiến Người C mất <b>{cost_per_point}</b>. Điểm bị trừ sẽ bị mất."
